{
  "$schema": "../release-manifest.v2.schema.json",
  "schemaVersion": 2,
  "generatedAt": "2026-10-02T06:35:32Z",
  "sourceSha": "0f6768676f50bc53a7a65dd7df24e6cb9508d5ff",
  "sourceCiRunUrl": "https://github.com/AI-shoks/WorkCard-Lifecycle/actions/runs/36973663549",
  "imageTag": "ghcr.io/ai-shoks/workcard-lifecycle/work-card:0f6768676f50bc53a7a65dd7df24e6cb9508d5ff",
  "imageDigest": "sha256:c8862cc212b257d4ab17682ea951fefcd27999d67d4e6a24509e61dee70a33ff",
  "immutableImage": "ghcr.io/ai-shoks/workcard-lifecycle/work-card@sha256:c8862cc212b257d4ab17682ea951fefcd27999d67d4e6a24509e61dee70a33ff",
  "imageConfigDigest": "sha256:275d874b146ff19892a5ff175b7681821375082ede7ddfa6c8761a74698c0ccb",
  "ociRevisionLabel": "0f6768676f50bc53a7a65dd7df24e6cb9508d5ff",
  "platform": "linux/amd64",
  "buildScanRunUrl": "https://github.com/AI-shoks/WorkCard-Lifecycle/actions/runs/36974161603/attempts/1",
  "sourceBuildRunUrl": "https://github.com/AI-shoks/WorkCard-Lifecycle/actions/runs/36974161603/attempts/1",
  "scan": {
    "status": "passed",
    "image": "ghcr.io/ai-shoks/workcard-lifecycle/work-card@sha256:c8862cc212b257d4ab17682ea951fefcd27999d67d4e6a24509e61dee70a33ff",
    "imageConfigDigest": "sha256:275d874b146ff19892a5ff175b7681821375082ede7ddfa6c8761a74698c0ccb",
    "scannerImage": "aquasec/trivy:0.74.0@sha256:62b1e65e8869bc4b4c6aa4fa2b21595256c7c2f6018a9d9ad61caf87187c1969",
    "reportPath": ".quality-results/release/image-vulnerabilities.json",
    "reportSha256": "sha256:8005cea6598dc63e9f70f4a4cc85e67381eed695aa5947c4d66935dd2bd0b6d7",
    "reportSummary": {
      "schemaVersion": 2,
      "artifactType": "container_image",
      "targetCount": 2,
      "vulnerabilityCount": 0,
      "severityThreshold": [
        "HIGH",
        "CRITICAL"
      ]
    }
  },
  "migrationsChecksumSummary": {
    "algorithm": "sha256",
    "digest": "sha256:26c4573a527c8748a0cd837b844c433fdb4dc8a5ee599dbab7a3060c3a0357cd",
    "files": [
      {
        "path": "apps/api/migrations/0001_foundation.sql",
        "sha256": "477a1a5d6eb9191b90095713f7daadd2df8b7972576a4675b20e13baab9ecfd7"
      },
      {
        "path": "apps/api/migrations/0002_backend-vertical-slice.sql",
        "sha256": "897bf313454d5191d0dbe6214e56100d1b0a0ea76dffe31bd05da81c863b551b"
      },
      {
        "path": "apps/api/migrations/0003_align-operation-plan-norm-precision.sql",
        "sha256": "ab79117fdc3918465039b4ce00eca234aabc017c4b91f89b08addd51c2a9b2a9"
      },
      {
        "path": "apps/api/migrations/0004_demo-maintenance-state.sql",
        "sha256": "0419e3ee2a1cebf03937410238dfdd8dab2d46e164910ac3ca8a8fc61fd8dab1"
      }
    ]
  },
  "lifecycleEvidence": {
    "mode": "append-only-files",
    "directory": "docs/release/evidence/0f6768676f50bc53a7a65dd7df24e6cb9508d5ff",
    "recordSchema": "docs/release/release-evidence.v2.schema.json"
  }
}
