{
  "$schema": "../release-manifest.v2.schema.json",
  "schemaVersion": 2,
  "generatedAt": "2026-09-29T16:27:22Z",
  "sourceSha": "bdb2647520639b9ca690dfd6d00402076463a63a",
  "sourceCiRunUrl": "https://github.com/AI-shoks/WorkCard-Lifecycle/actions/runs/36544788733",
  "imageTag": "ghcr.io/ai-shoks/workcard-lifecycle/work-card:bdb2647520639b9ca690dfd6d00402076463a63a",
  "imageDigest": "sha256:140d39890df43a8fb4db2a4c7eceec47634e1a5654edef618fe97d75b793c093",
  "immutableImage": "ghcr.io/ai-shoks/workcard-lifecycle/work-card@sha256:140d39890df43a8fb4db2a4c7eceec47634e1a5654edef618fe97d75b793c093",
  "imageConfigDigest": "sha256:a18ed96d1bd3005787082f77de33852474bb502dd2d4952db4b184a8f3638ea5",
  "ociRevisionLabel": "bdb2647520639b9ca690dfd6d00402076463a63a",
  "platform": "linux/amd64",
  "buildScanRunUrl": "https://github.com/AI-shoks/WorkCard-Lifecycle/actions/runs/36597671054/attempts/1",
  "sourceBuildRunUrl": "https://github.com/AI-shoks/WorkCard-Lifecycle/actions/runs/36597671054/attempts/1",
  "scan": {
    "status": "passed",
    "image": "ghcr.io/ai-shoks/workcard-lifecycle/work-card@sha256:140d39890df43a8fb4db2a4c7eceec47634e1a5654edef618fe97d75b793c093",
    "imageConfigDigest": "sha256:a18ed96d1bd3005787082f77de33852474bb502dd2d4952db4b184a8f3638ea5",
    "scannerImage": "aquasec/trivy:0.74.0@sha256:62b1e65e8869bc4b4c6aa4fa2b21595256c7c2f6018a9d9ad61caf87187c1969",
    "reportPath": ".quality-results/release/image-vulnerabilities.json",
    "reportSha256": "sha256:9dab90a0b43b7f1ac7d0fcf6ffb567fb62aaf2b89a4e7e773f2a661ad7287404",
    "reportSummary": {
      "schemaVersion": 2,
      "artifactType": "container_image",
      "targetCount": 2,
      "vulnerabilityCount": 0,
      "severityThreshold": [
        "HIGH",
        "CRITICAL"
      ]
    }
  },
  "migrationsChecksumSummary": {
    "algorithm": "sha256",
    "digest": "sha256:26c4573a527c8748a0cd837b844c433fdb4dc8a5ee599dbab7a3060c3a0357cd",
    "files": [
      {
        "path": "apps/api/migrations/0001_foundation.sql",
        "sha256": "477a1a5d6eb9191b90095713f7daadd2df8b7972576a4675b20e13baab9ecfd7"
      },
      {
        "path": "apps/api/migrations/0002_backend-vertical-slice.sql",
        "sha256": "897bf313454d5191d0dbe6214e56100d1b0a0ea76dffe31bd05da81c863b551b"
      },
      {
        "path": "apps/api/migrations/0003_align-operation-plan-norm-precision.sql",
        "sha256": "ab79117fdc3918465039b4ce00eca234aabc017c4b91f89b08addd51c2a9b2a9"
      },
      {
        "path": "apps/api/migrations/0004_demo-maintenance-state.sql",
        "sha256": "0419e3ee2a1cebf03937410238dfdd8dab2d46e164910ac3ca8a8fc61fd8dab1"
      }
    ]
  },
  "lifecycleEvidence": {
    "mode": "append-only-files",
    "directory": "docs/release/evidence/bdb2647520639b9ca690dfd6d00402076463a63a",
    "recordSchema": "docs/release/release-evidence.v2.schema.json"
  }
}
